<?xml version="1.0" encoding="UTF-8" ?>
<Orders xmlns="http://it-academy.by/akhmelev"
        xmlns:xsi="http://www.w3.org/2001/XMLSchema-instance"
        xsi:schemaLocation="http://it-academy.by/akhmelev Order.xsd"
>
    <Person>
        <Email>test123@mail.ru</Email>
        <Nickname>Test123</Nickname>
        <Password>qwerty</Password>
        <Contract>
            <Model>wardrobe_1250_600_BS_V350</Model>
            <Name>Ivan</Name>
            <Address>Minsk, Kolasa, 8-35</Address>
            <Phone>33-525-33</Phone>
            <Number>W_18_05_18_1</Number>
            <DataContr>2018 may 18</DataContr>
            <Price>620</Price>
            <KeyMoney>350</KeyMoney>
            <Production>
                <Measure>2018 may 18</Measure>
                <InProduction>2018 may 21</InProduction>
                <GetMaterials>2018 may 25</GetMaterials>
                <Fitting>2018 may 26</Fitting>
                <Refund>270</Refund>
            </Production>
        </Contract>
    </Person>


    <Person>
        <Email>test321@mail.ru</Email>
        <Nickname>Test321</Nickname>
        <Password>qwerty</Password>
        <Contract>
            <Model>wardrobe_900_550_BI</Model>
            <Name>Petr</Name>
            <Address>Minsk, Philimonovd, 89-359</Address>
            <Phone>35-525-53</Phone>
            <Number>W_18_05_18_2</Number>
            <DataContr>2018 may 18</DataContr>
            <Price>350</Price>
            <KeyMoney>170</KeyMoney>
            <Production>
                <Measure>2018 may 18</Measure>
                <InProduction>2018 may 21</InProduction>
                <GetMaterials>2018 may 25</GetMaterials>
                <Fitting>2018 may 26</Fitting>
                <Refund>180</Refund>
            </Production>
        </Contract>
    </Person>


</Orders>